title,abbr,key,category,parent,parent_key,description,url,jurisdiction,jurisdiction_code,source,source_url,address,contact,email,tags,created_at,updated_at
Newfoundland and Labrador Hydro,newfoundland-and-labrador-hydro,nl/newfoundland-and-labrador-hydro,Agencies,,,"",http://www.nlh.nf.ca,Newfoundland and Labrador,ocd-division/country:ca/province:nl,Newfoundland and Labrador Departments and Agencies,http://www.gov.nl.ca/departments.html,"",,,,7/8/13,7/8/13
Newfoundland and Labrador Medical Care Plan - MCP,newfoundland-and-labrador-medical-care-plan-mcp,nl/newfoundland-and-labrador-medical-care-plan-mcp,Agencies,,,"",http://www.health.gov.nl.ca/mcp/,Newfoundland and Labrador,ocd-division/country:ca/province:nl,Newfoundland and Labrador Departments and Agencies,http://www.gov.nl.ca/departments.html,"",,,,7/8/13,7/8/13
Office of the Auditor General,office-of-the-auditor-general,nl/office-of-the-auditor-general,Agencies,,,"",http://www.ag.gov.nl.ca/ag/,Newfoundland and Labrador,ocd-division/country:ca/province:nl,Newfoundland and Labrador Departments and Agencies,http://www.gov.nl.ca/departments.html,"",,,,7/8/13,7/8/13
Office of the Chief Electoral Officer,office-of-the-chief-electoral-officer,nl/office-of-the-chief-electoral-officer,Agencies,,,"",http://www.elections.gov.nl.ca/elections/,Newfoundland and Labrador,ocd-division/country:ca/province:nl,Newfoundland and Labrador Departments and Agencies,http://www.gov.nl.ca/departments.html,"",,,,7/8/13,7/8/13
Office of the Child and Youth Advocate,office-of-the-child-and-youth-advocate,nl/office-of-the-child-and-youth-advocate,Agencies,,,"",http://www.childandyouthadvocate.nf.ca/,Newfoundland and Labrador,ocd-division/country:ca/province:nl,Newfoundland and Labrador Departments and Agencies,http://www.gov.nl.ca/departments.html,"",,,,7/8/13,7/8/13
Office of the Citizens' Representative,office-of-the-citizens-representative,nl/office-of-the-citizens-representative,Agencies,,,"",http://www.citizensrep.nl.ca/,Newfoundland and Labrador,ocd-division/country:ca/province:nl,Newfoundland and Labrador Departments and Agencies,http://www.gov.nl.ca/departments.html,"",,,,7/8/13,7/8/13
Office of the Information and Privacy Commissioner,office-of-the-information-and-privacy-commissioner,nl/office-of-the-information-and-privacy-commissioner,Agencies,,,"",http://www.gov.nl.ca/oipc,Newfoundland and Labrador,ocd-division/country:ca/province:nl,Newfoundland and Labrador Departments and Agencies,http://www.gov.nl.ca/departments.html,"",,,,7/8/13,7/8/13
Provincial Information and Library Resources Board,provincial-information-and-library-resources-board,nl/provincial-information-and-library-resources-board,Agencies,,,"",http://www.nlpl.ca,Newfoundland and Labrador,ocd-division/country:ca/province:nl,Newfoundland and Labrador Departments and Agencies,http://www.gov.nl.ca/departments.html,"",,,,7/8/13,7/8/13
Public Service Commission,public-service-commission,nl/public-service-commission,Agencies,,,"The Public Service Commission (PSC) is committed to, and responsible for, oversight of and policy for merit-based appointments and promotions within the Public Service of NL. The PSC also offers a range of programs and services dedicated to supporting departments and individuals in achieving individual and workplace health and productivity.Find out more about what we do...",http://www.psc.gov.nl.ca/psc/,Newfoundland and Labrador,ocd-division/country:ca/province:nl,Newfoundland and Labrador Departments and Agencies,http://www.gov.nl.ca/departments.html," 50 Mundy Pond RoadP.O. Box 8700 St. John’s, NL A1B 4J6 ",,,,7/8/13,7/8/13
Royal Newfoundland Constabulary,royal-newfoundland-constabulary,nl/royal-newfoundland-constabulary,Agencies,,,"",http://www.rnc.gov.nl.ca,Newfoundland and Labrador,ocd-division/country:ca/province:nl,Newfoundland and Labrador Departments and Agencies,http://www.gov.nl.ca/departments.html,"",,,,7/8/13,7/8/13
Research & Development Corporation,research-development-corporation,nl/research-development-corporation,Agencies,,,"",http://www.researchnl.com,Newfoundland and Labrador,ocd-division/country:ca/province:nl,Newfoundland and Labrador Departments and Agencies,http://www.gov.nl.ca/departments.html,"",,,,7/8/13,7/8/13
Workplace Health Safety and Compensation Commission,workplace-health-safety-and-compensation-commission,nl/workplace-health-safety-and-compensation-commission,Agencies,,,"",http://www.whscc.nl.ca,Newfoundland and Labrador,ocd-division/country:ca/province:nl,Newfoundland and Labrador Departments and Agencies,http://www.gov.nl.ca/departments.html,"",,,,7/8/13,7/8/13
"Workplace Health, Safety and Compensation Review Division",workplace-health-safety-and-compensation-review-division,nl/workplace-health-safety-and-compensation-review-division,Agencies,,,"The Workplace Health, Safety and Compensation Review Division (WHSCRD) is committed to improving services to injured workers and employers of Newfoundland and Labrador.",http://www.gov.nl.ca/whscrd/index.html,Newfoundland and Labrador,ocd-division/country:ca/province:nl,Newfoundland and Labrador Departments and Agencies,http://www.gov.nl.ca/departments.html," Dorset Building, 2nd Floor 6 Mount Carson Avenue Mount Pearl, NL A1N 3K4 ",,whscrd@gov.nl.ca,,7/8/13,7/8/13
